{
  "id": "Policy.Core",
  "name": "Policy Core",
  "version": "1.0.0",
  "contracts_version": "1.0.0",
  "assembly": "Burbuja.Plugins.Policy.Core.dll",
  "entry_type": "Burbuja.Plugins.Policy.Core.PolicyCorePlugin",
  "load": "dynamic",
  "provides": ["policy.rules"],
  "extension_points": ["policy.rules"],
  "requires": [],
  "roles": ["all"],
  "config_section": "Plugins:Policy.Core",
  "trusted": true,
  "depends_on": [],
  "load_order": 100
}
