{
  "id": "Supervisor",
  "name": "Supervisor",
  "version": "1.0.0",
  "contracts_version": "1.0.0",
  "assembly": "Burbuja.Plugins.Supervisor.dll",
  "entry_type": "Burbuja.Plugins.Supervisor.SupervisorPlugin",
  "load": "dynamic",
  "provides": ["agents.arbiter", "mentor"],
  "extension_points": ["agents.arbiter"],
  "requires": [],
  "roles": ["all", "worker"],
  "config_section": null,
  "trusted": true,
  "depends_on": [],
  "load_order": 310
}
