{
  "id": "Tools.Workspace",
  "name": "Workspace tools",
  "version": "1.0.0",
  "contracts_version": "1.0.0",
  "assembly": "Burbuja.Plugins.Tools.Workspace.dll",
  "entry_type": "Burbuja.Plugins.Tools.Workspace.WorkspaceToolsPlugin",
  "load": "dynamic",
  "provides": ["tools.workspace"],
  "extension_points": ["agents.tool"],
  "requires": ["ProcessExecution", "FilesystemWrite"],
  "roles": ["all", "worker"],
  "config_section": null,
  "trusted": true,
  "depends_on": [],
  "load_order": 320
}
