{
  "id": "Llm.DeepSeek",
  "name": "DeepSeek LLM",
  "version": "1.0.0",
  "contracts_version": "1.0.0",
  "assembly": "Burbuja.Plugins.Llm.DeepSeek.dll",
  "entry_type": "Burbuja.Plugins.Llm.DeepSeek.DeepSeekPlugin",
  "load": "dynamic",
  "provides": ["llm.provider", "llm.pricebook"],
  "extension_points": ["llm.provider"],
  "requires": ["Network", "Secrets"],
  "roles": ["all", "worker"],
  "config_section": "DeepSeek",
  "trusted": true,
  "depends_on": [],
  "load_order": 305
}
